{
  "repo": "adopted-ember-addons/ember-cli-content-security-policy",
  "url": "https://github.com/adopted-ember-addons/ember-cli-content-security-policy",
  "stars": 157,
  "addedBy": "weakcrypto-scanner[bot]",
  "addedAt": "2026-10-31T14:14:27Z",
  "via": "corpus",
  "commit": "b6c3e093203acdba8b954442e49c0e91a6d25478"
}
