{
  "repo": "sap/cloud-security-services-integration-library",
  "url": "https://github.com/SAP/cloud-security-services-integration-library",
  "stars": 176,
  "addedBy": "weakcrypto-scanner[bot]",
  "addedAt": "2026-10-30T14:59:33Z",
  "via": "corpus",
  "commit": "85f9815218d083d1ef0dd6c09a547abeb08c07d0"
}
