{
  "repo": "siavashbamshadnia/laravel-source-encrypter",
  "url": "https://github.com/SiavashBamshadnia/Laravel-Source-Encrypter",
  "stars": 587,
  "addedBy": "weakcrypto-scanner[bot]",
  "addedAt": "2026-10-24T03:31:52Z",
  "via": "corpus",
  "commit": "0b10af48e20301d35789f3b977406384d44d700f"
}
