{
  "repo": "mattie432/ethvote-ethereum-blockchain-voting-system",
  "url": "https://github.com/Mattie432/EthVote-Ethereum-Blockchain-Voting-System",
  "stars": 110,
  "addedBy": "weakcrypto-scanner[bot]",
  "addedAt": "2026-10-18T10:21:14Z",
  "via": "corpus",
  "commit": "c192b00e2dfda7fd00286c8cc7b8afa870ea94a9"
}
