{
  "repo": "apress/pivotal-certified-pro-spring-dev-exam-02",
  "url": "https://github.com/Apress/pivotal-certified-pro-spring-dev-exam-02",
  "stars": 172,
  "addedBy": "weakcrypto-scanner[bot]",
  "addedAt": "2026-10-30T18:20:20Z",
  "via": "corpus",
  "commit": "1fc4473e0047ddd0dd5ace9e60896e807080ef20"
}
