{
  "repo": "angulartemplates/firebase-authentication-with-angular",
  "url": "https://github.com/AngularTemplates/firebase-authentication-with-angular",
  "stars": 304,
  "addedBy": "weakcrypto-scanner[bot]",
  "addedAt": "2026-10-26T23:29:19Z",
  "via": "corpus",
  "commit": "36cc5f6d8356307d33b6114fd001e62b7ddcf5b5"
}
