{
  "repo": "soumyadip007/e-medical-system-web-project-using-spring-boot-security-jpa-rest-thymeleaf-hql",
  "url": "https://github.com/soumyadip007/E-Medical-System-Web-Project-Using-Spring-Boot-Security-JPA-Rest-Thymeleaf-HQL",
  "stars": 190,
  "addedBy": "weakcrypto-scanner[bot]",
  "addedAt": "2026-10-29T20:37:52Z",
  "via": "corpus",
  "commit": "4460938fe40b13cee70fbc1c7f1e426576ba6694"
}
