{
  "repo": "0x10debug/vps-security-enhancement-scripts",
  "url": "https://github.com/0x10debug/vps-security-enhancement-scripts",
  "stars": 238,
  "addedBy": "weakcrypto-scanner[bot]",
  "addedAt": "2026-10-28T06:26:00Z",
  "via": "corpus",
  "commit": "8ec904a150aeae3e92d58a55768e61ce59be5dac"
}
