{
  "repo": "webdevsimplified/nodejs-user-authentication",
  "url": "https://github.com/WebDevSimplified/Nodejs-User-Authentication",
  "stars": 142,
  "addedBy": "weakcrypto-scanner[bot]",
  "addedAt": "2026-11-01T13:01:57Z",
  "via": "corpus",
  "commit": "c9ebba5cdf174369e061072ae10f487d53ed2491"
}
