{
  "repo": "eu-digital-identity-wallet/eudi-app-android-wallet-ui",
  "url": "https://github.com/eu-digital-identity-wallet/eudi-app-android-wallet-ui",
  "stars": 227,
  "addedBy": "weakcrypto-scanner[bot]",
  "addedAt": "2026-10-15T05:53:32Z",
  "via": "corpus",
  "commit": "7f40440fcb24ad4915786349f1c6b12d16e7ec07"
}
